{
  "$schema": "https://json-schema.org/draft/2020-12/schema",
  "$id": "https://github.com/Halildeu/platform-k8s-gitops/schema/endpoint-outdated-software-payload-v1.schema.json",
  "title": "Endpoint Outdated Software Payload (AG-036) v1",
  "description": "Wire contract for the AG-036 outdated-software probe block carried under the COLLECT_INVENTORY result at details.inventory.outdatedSoftware. Source of truth = platform-agent internal/inventory/outdated_software.go OutdatedSoftwareResult (PR #38, schemaVersion=1, merged sha a29eef49). Backend ingest (outdated-software persist/query) and web view MUST conform to this shape. Redaction boundary (machine-enforced here, agent-enforced at source via TestOutdatedSoftwarePackage_JSONKeys): per-package wire fields are EXACTLY packageId + installedVersion + availableVersion — NO display name / publisher / install location / license / download URL. The probe is read-only ('winget upgrade --include-returning-apps --source winget'); it NEVER mutates package state. Thresholds/caps (MaxUpgrade=512) are agent-side const and NOT payload-configurable.",
  "type": "object",
  "additionalProperties": false,
  "required": [
    "schemaVersion",
    "supported",
    "probeComplete",
    "upgradeCount",
    "upgrade",
    "upgradeTruncated",
    "maxUpgrade",
    "sourceUsed",
    "probeDurationMs"
  ],
  "properties": {
    "schemaVersion": {
      "type": "integer",
      "const": 1,
      "description": "Payload schema version. const 1 pins AG-036 v1. A new shape requires a new version + a new schema $id (see forward-compat rule in docs/faz-22-outdated-software-contract-v1.md)."
    },
    "supported": {
      "type": "boolean",
      "description": "false on non-Windows runtimes (the agent still emits canonical OS metadata so the backend persists 'probe not supported here' instead of treating absence as a failed ingest)."
    },
    "probeComplete": {
      "type": "boolean",
      "description": "true only when probeErrors is empty AND sourceUsed != none (fail-closed: any probeError or a no-source run flips this false; consumers MUST NOT render an incomplete probe as 'fully up to date')."
    },
    "upgradeCount": {
      "type": "integer",
      "minimum": 0,
      "description": "Number of upgradeable packages reported in 'upgrade'. Capped at maxUpgrade (512); see the upgradeTruncated note + the known >512 limitation in the binding doc."
    },
    "upgrade": {
      "type": "array",
      "maxItems": 512,
      "description": "Upgradeable package entries. ALWAYS serializes as [] (never null). Capped at maxUpgrade (512).",
      "items": { "$ref": "#/$defs/outdatedPackage" }
    },
    "upgradeTruncated": {
      "type": "boolean",
      "description": "true when the observed upgrade set exceeded maxUpgrade and was truncated. NOTE (known v1 limitation, tracked as a follow-up): the agent-side parser caps at 512 before this flag is evaluated, so a host with >512 pending upgrades is currently truncated with upgradeTruncated=false. Consumers should treat upgradeCount==maxUpgrade as 'possibly truncated'."
    },
    "maxUpgrade": {
      "type": "integer",
      "const": 512,
      "description": "Agent-side upgrade cap (MaxOutdatedPackages = 512)."
    },
    "sourceUsed": {
      "type": "string",
      "enum": ["winget", "none"],
      "description": "winget = read-only 'winget upgrade --include-returning-apps --source winget'. none = no probe ran (unsupported platform)."
    },
    "probeErrors": {
      "type": "array",
      "description": "Optional (omitempty at source). Any entry flips probeComplete=false.",
      "items": { "$ref": "#/$defs/probeError" }
    },
    "probeDurationMs": { "type": "integer", "minimum": 0 }
  },
  "$defs": {
    "outdatedPackage": {
      "type": "object",
      "additionalProperties": false,
      "required": ["packageId", "installedVersion", "availableVersion"],
      "description": "Per-package wire shape. EXACTLY these three keys — the redaction boundary (no display name / publisher / install location / license / download URL) is machine-enforced both here (additionalProperties:false) and at source (TestOutdatedSoftwarePackage_JSONKeys).",
      "properties": {
        "packageId": {
          "type": "string",
          "minLength": 1,
          "maxLength": 256,
          "pattern": "^\\S+$",
          "description": "Stable winget package id (e.g. '7zip.7zip', 'Microsoft.VisualStudioCode'). No whitespace — it is an id, not a human-facing display name. The only package-level correlation key on the wire."
        },
        "installedVersion": {
          "type": "string",
          "minLength": 1,
          "maxLength": 128,
          "description": "Currently-installed version string (public, non-PII)."
        },
        "availableVersion": {
          "type": "string",
          "minLength": 1,
          "maxLength": 128,
          "description": "Available (newer) version string (public, non-PII). The from/to pair is what makes the 'outdated' signal actionable."
        }
      }
    },
    "probeError": {
      "type": "object",
      "additionalProperties": false,
      "required": ["code"],
      "properties": {
        "source": { "type": "string", "enum": ["winget", "none"] },
        "code": {
          "type": "string",
          "enum": [
            "UNSUPPORTED_PLATFORM",
            "WINGET_NOT_FOUND",
            "WINGET_TIMEOUT",
            "WINGET_FAILED",
            "WINGET_EMPTY_OUTPUT",
            "WINGET_PARSE_ERROR"
          ]
        },
        "summary": {
          "type": "string",
          "maxLength": 200,
          "description": "Bounded operator-facing text; static phrasing; NEVER a raw errno dump, filesystem path, or package display name."
        }
      }
    }
  },
  "examples": [
    {
      "schemaVersion": 1,
      "supported": true,
      "probeComplete": true,
      "upgradeCount": 2,
      "upgrade": [
        { "packageId": "7zip.7zip", "installedVersion": "24.09", "availableVersion": "25.01" },
        { "packageId": "Microsoft.VisualStudioCode", "installedVersion": "1.89.0", "availableVersion": "1.91.1" }
      ],
      "upgradeTruncated": false,
      "maxUpgrade": 512,
      "sourceUsed": "winget",
      "probeDurationMs": 45
    },
    {
      "schemaVersion": 1,
      "supported": true,
      "probeComplete": true,
      "upgradeCount": 0,
      "upgrade": [],
      "upgradeTruncated": false,
      "maxUpgrade": 512,
      "sourceUsed": "winget",
      "probeDurationMs": 28
    },
    {
      "schemaVersion": 1,
      "supported": false,
      "probeComplete": false,
      "upgradeCount": 0,
      "upgrade": [],
      "upgradeTruncated": false,
      "maxUpgrade": 512,
      "sourceUsed": "none",
      "probeErrors": [
        { "source": "none", "code": "UNSUPPORTED_PLATFORM", "summary": "outdated-software probe not supported on this runtime" }
      ],
      "probeDurationMs": 0
    }
  ]
}
