{
  "schemaVersion": 1,
  "supported": true,
  "probeComplete": true,
  "upgradeCount": 512,
  "upgrade": [
    {
      "packageId": "Contoso.App0001",
      "installedVersion": "2.0.1",
      "availableVersion": "2.1.1"
    },
    {
      "packageId": "Contoso.App0002",
      "installedVersion": "2.0.2",
      "availableVersion": "2.1.2"
    },
    {
      "packageId": "Contoso.App0003",
      "installedVersion": "2.0.3",
      "availableVersion": "2.1.3"
    },
    {
      "packageId": "Contoso.App0004",
      "installedVersion": "2.0.4",
      "availableVersion": "2.1.4"
    },
    {
      "packageId": "Contoso.App0005",
      "installedVersion": "2.0.5",
      "availableVersion": "2.1.5"
    },
    {
      "packageId": "Contoso.App0006",
      "installedVersion": "2.0.6",
      "availableVersion": "2.1.6"
    },
    {
      "packageId": "Contoso.App0007",
      "installedVersion": "2.0.7",
      "availableVersion": "2.1.7"
    },
    {
      "packageId": "Contoso.App0008",
      "installedVersion": "2.0.8",
      "availableVersion": "2.1.8"
    },
    {
      "packageId": "Contoso.App0009",
      "installedVersion": "2.0.9",
      "availableVersion": "2.1.9"
    },
    {
      "packageId": "Contoso.App0010",
      "installedVersion": "2.0.10",
      "availableVersion": "2.1.10"
    },
    {
      "packageId": "Contoso.App0011",
      "installedVersion": "2.0.11",
      "availableVersion": "2.1.11"
    },
    {
      "packageId": "Contoso.App0012",
      "installedVersion": "2.0.12",
      "availableVersion": "2.1.12"
    },
    {
      "packageId": "Contoso.App0013",
      "installedVersion": "2.0.13",
      "availableVersion": "2.1.13"
    },
    {
      "packageId": "Contoso.App0014",
      "installedVersion": "2.0.14",
      "availableVersion": "2.1.14"
    },
    {
      "packageId": "Contoso.App0015",
      "installedVersion": "2.0.15",
      "availableVersion": "2.1.15"
    },
    {
      "packageId": "Contoso.App0016",
      "installedVersion": "2.0.16",
      "availableVersion": "2.1.16"
    },
    {
      "packageId": "Contoso.App0017",
      "installedVersion": "2.0.17",
      "availableVersion": "2.1.17"
    },
    {
      "packageId": "Contoso.App0018",
      "installedVersion": "2.0.18",
      "availableVersion": "2.1.18"
    },
    {
      "packageId": "Contoso.App0019",
      "installedVersion": "2.0.19",
      "availableVersion": "2.1.19"
    },
    {
      "packageId": "Contoso.App0020",
      "installedVersion": "2.0.20",
      "availableVersion": "2.1.20"
    },
    {
      "packageId": "Contoso.App0021",
      "installedVersion": "2.0.21",
      "availableVersion": "2.1.21"
    },
    {
      "packageId": "Contoso.App0022",
      "installedVersion": "2.0.22",
      "availableVersion": "2.1.22"
    },
    {
      "packageId": "Contoso.App0023",
      "installedVersion": "2.0.23",
      "availableVersion": "2.1.23"
    },
    {
      "packageId": "Contoso.App0024",
      "installedVersion": "2.0.24",
      "availableVersion": "2.1.24"
    },
    {
      "packageId": "Contoso.App0025",
      "installedVersion": "2.0.25",
      "availableVersion": "2.1.25"
    },
    {
      "packageId": "Contoso.App0026",
      "installedVersion": "2.0.26",
      "availableVersion": "2.1.26"
    },
    {
      "packageId": "Contoso.App0027",
      "installedVersion": "2.0.27",
      "availableVersion": "2.1.27"
    },
    {
      "packageId": "Contoso.App0028",
      "installedVersion": "2.0.28",
      "availableVersion": "2.1.28"
    },
    {
      "packageId": "Contoso.App0029",
      "installedVersion": "2.0.29",
      "availableVersion": "2.1.29"
    },
    {
      "packageId": "Contoso.App0030",
      "installedVersion": "2.0.30",
      "availableVersion": "2.1.30"
    },
    {
      "packageId": "Contoso.App0031",
      "installedVersion": "2.0.31",
      "availableVersion": "2.1.31"
    },
    {
      "packageId": "Contoso.App0032",
      "installedVersion": "2.0.32",
      "availableVersion": "2.1.32"
    },
    {
      "packageId": "Contoso.App0033",
      "installedVersion": "2.0.33",
      "availableVersion": "2.1.33"
    },
    {
      "packageId": "Contoso.App0034",
      "installedVersion": "2.0.34",
      "availableVersion": "2.1.34"
    },
    {
      "packageId": "Contoso.App0035",
      "installedVersion": "2.0.35",
      "availableVersion": "2.1.35"
    },
    {
      "packageId": "Contoso.App0036",
      "installedVersion": "2.0.36",
      "availableVersion": "2.1.36"
    },
    {
      "packageId": "Contoso.App0037",
      "installedVersion": "2.0.37",
      "availableVersion": "2.1.37"
    },
    {
      "packageId": "Contoso.App0038",
      "installedVersion": "2.0.38",
      "availableVersion": "2.1.38"
    },
    {
      "packageId": "Contoso.App0039",
      "installedVersion": "2.0.39",
      "availableVersion": "2.1.39"
    },
    {
      "packageId": "Contoso.App0040",
      "installedVersion": "2.0.40",
      "availableVersion": "2.1.40"
    },
    {
      "packageId": "Contoso.App0041",
      "installedVersion": "2.0.41",
      "availableVersion": "2.1.41"
    },
    {
      "packageId": "Contoso.App0042",
      "installedVersion": "2.0.42",
      "availableVersion": "2.1.42"
    },
    {
      "packageId": "Contoso.App0043",
      "installedVersion": "2.0.43",
      "availableVersion": "2.1.43"
    },
    {
      "packageId": "Contoso.App0044",
      "installedVersion": "2.0.44",
      "availableVersion": "2.1.44"
    },
    {
      "packageId": "Contoso.App0045",
      "installedVersion": "2.0.45",
      "availableVersion": "2.1.45"
    },
    {
      "packageId": "Contoso.App0046",
      "installedVersion": "2.0.46",
      "availableVersion": "2.1.46"
    },
    {
      "packageId": "Contoso.App0047",
      "installedVersion": "2.0.47",
      "availableVersion": "2.1.47"
    },
    {
      "packageId": "Contoso.App0048",
      "installedVersion": "2.0.48",
      "availableVersion": "2.1.48"
    },
    {
      "packageId": "Contoso.App0049",
      "installedVersion": "2.0.49",
      "availableVersion": "2.1.49"
    },
    {
      "packageId": "Contoso.App0050",
      "installedVersion": "2.0.50",
      "availableVersion": "2.1.50"
    },
    {
      "packageId": "Contoso.App0051",
      "installedVersion": "2.0.51",
      "availableVersion": "2.1.51"
    },
    {
      "packageId": "Contoso.App0052",
      "installedVersion": "2.0.52",
      "availableVersion": "2.1.52"
    },
    {
      "packageId": "Contoso.App0053",
      "installedVersion": "2.0.53",
      "availableVersion": "2.1.53"
    },
    {
      "packageId": "Contoso.App0054",
      "installedVersion": "2.0.54",
      "availableVersion": "2.1.54"
    },
    {
      "packageId": "Contoso.App0055",
      "installedVersion": "2.0.55",
      "availableVersion": "2.1.55"
    },
    {
      "packageId": "Contoso.App0056",
      "installedVersion": "2.0.56",
      "availableVersion": "2.1.56"
    },
    {
      "packageId": "Contoso.App0057",
      "installedVersion": "2.0.57",
      "availableVersion": "2.1.57"
    },
    {
      "packageId": "Contoso.App0058",
      "installedVersion": "2.0.58",
      "availableVersion": "2.1.58"
    },
    {
      "packageId": "Contoso.App0059",
      "installedVersion": "2.0.59",
      "availableVersion": "2.1.59"
    },
    {
      "packageId": "Contoso.App0060",
      "installedVersion": "2.0.60",
      "availableVersion": "2.1.60"
    },
    {
      "packageId": "Contoso.App0061",
      "installedVersion": "2.0.61",
      "availableVersion": "2.1.61"
    },
    {
      "packageId": "Contoso.App0062",
      "installedVersion": "2.0.62",
      "availableVersion": "2.1.62"
    },
    {
      "packageId": "Contoso.App0063",
      "installedVersion": "2.0.63",
      "availableVersion": "2.1.63"
    },
    {
      "packageId": "Contoso.App0064",
      "installedVersion": "2.0.64",
      "availableVersion": "2.1.64"
    },
    {
      "packageId": "Contoso.App0065",
      "installedVersion": "2.0.65",
      "availableVersion": "2.1.65"
    },
    {
      "packageId": "Contoso.App0066",
      "installedVersion": "2.0.66",
      "availableVersion": "2.1.66"
    },
    {
      "packageId": "Contoso.App0067",
      "installedVersion": "2.0.67",
      "availableVersion": "2.1.67"
    },
    {
      "packageId": "Contoso.App0068",
      "installedVersion": "2.0.68",
      "availableVersion": "2.1.68"
    },
    {
      "packageId": "Contoso.App0069",
      "installedVersion": "2.0.69",
      "availableVersion": "2.1.69"
    },
    {
      "packageId": "Contoso.App0070",
      "installedVersion": "2.0.70",
      "availableVersion": "2.1.70"
    },
    {
      "packageId": "Contoso.App0071",
      "installedVersion": "2.0.71",
      "availableVersion": "2.1.71"
    },
    {
      "packageId": "Contoso.App0072",
      "installedVersion": "2.0.72",
      "availableVersion": "2.1.72"
    },
    {
      "packageId": "Contoso.App0073",
      "installedVersion": "2.0.73",
      "availableVersion": "2.1.73"
    },
    {
      "packageId": "Contoso.App0074",
      "installedVersion": "2.0.74",
      "availableVersion": "2.1.74"
    },
    {
      "packageId": "Contoso.App0075",
      "installedVersion": "2.0.75",
      "availableVersion": "2.1.75"
    },
    {
      "packageId": "Contoso.App0076",
      "installedVersion": "2.0.76",
      "availableVersion": "2.1.76"
    },
    {
      "packageId": "Contoso.App0077",
      "installedVersion": "2.0.77",
      "availableVersion": "2.1.77"
    },
    {
      "packageId": "Contoso.App0078",
      "installedVersion": "2.0.78",
      "availableVersion": "2.1.78"
    },
    {
      "packageId": "Contoso.App0079",
      "installedVersion": "2.0.79",
      "availableVersion": "2.1.79"
    },
    {
      "packageId": "Contoso.App0080",
      "installedVersion": "2.0.80",
      "availableVersion": "2.1.80"
    },
    {
      "packageId": "Contoso.App0081",
      "installedVersion": "2.0.81",
      "availableVersion": "2.1.81"
    },
    {